{
  "schema_version": "benchresult/v1",
  "result_id": "m5max-dsv4q2-chat-run3",
  "measured_at": "2026-07-05T06:41:39Z",
  "pins": {
    "plan_hash": "a5c605b363a0a9c1e34b2b7c89021534ad30e6e39bf6e2939988249a6d3f1a4b",
    "model_sha256": "5a952f1e26bc654df36a8e654a97a5fde0bdaec81b863c7884f96b6da868832c",
    "runtime_commit": "b9870-2d973636e",
    "hwprofile_id": "apple_m5_max_137gb_detected"
  },
  "metrics": {
    "ttft_ms": 2297.16,
    "prefill_tps": 16.62,
    "decode_tps": 7.44,
    "token_latency_ms": {
      "p50": 130.69,
      "p95": 167.62,
      "p99": 248.22
    },
    "peak_vram_gb": null,
    "peak_ram_gb": 75.39,
    "ssd_read_gbps": null,
    "ssd_total_read_gb": 47.48,
    "expert_cache_hit_rate": null,
    "context_len_tokens": 8192
  },
  "workload_tasks": [
    {
      "task": "chat-factual",
      "passed": true,
      "notes": null
    },
    {
      "task": "chat-reasoning",
      "passed": true,
      "notes": null
    },
    {
      "task": "chat-summarize",
      "passed": true,
      "notes": null
    },
    {
      "task": "chat-instruction",
      "passed": true,
      "notes": null
    },
    {
      "task": "chat-longform",
      "passed": true,
      "notes": null
    }
  ],
  "environment": {
    "os": "Darwin 25.4.0",
    "notes": "suite=chat; client-side SSE chunk timing; power_w_avg=32.0"
  },
  "reproductions": [
    "m5max-dsv4q2-chat-run1",
    "m5max-dsv4q2-chat-run2"
  ],
  "status": "verified",
  "subject": {
    "modelprofile": "deepseek-v4-flash/q2_imatrix",
    "workload": "chat"
  },
  "usability_suggested": "interactive"
}
